{
  "schema": "ai-sdlc-module/v1",
  "id": "core",
  "version": "1.7.0",
  "kind": "core",
  "harness_api": {"min": "1.0.0", "max_exclusive": "2.0.0"},
  "requires": [],
  "description": "Core AI SDLC lifecycle, control-plane, and delivery skills.",
  "skills": [
    {"name": "ai-sdlc-approvals-sandbox", "path": "skills/ai-sdlc-approvals-sandbox"},
    {"name": "ai-sdlc-ba", "path": "skills/ai-sdlc-ba"},
    {"name": "ai-sdlc-backlog-decomposition-and-task-planning", "path": "skills/ai-sdlc-backlog-decomposition-and-task-planning"},
    {"name": "ai-sdlc-backlog-requirements-gap-review", "path": "skills/ai-sdlc-backlog-requirements-gap-review"},
    {"name": "ai-sdlc-branching", "path": "skills/ai-sdlc-branching"},
    {"name": "ai-sdlc-change-set", "path": "skills/ai-sdlc-change-set"},
    {"name": "ai-sdlc-change-impact", "path": "skills/ai-sdlc-change-impact"},
    {"name": "ai-sdlc-code-review", "path": "skills/ai-sdlc-code-review"},
    {"name": "ai-sdlc-commit-prep", "path": "skills/ai-sdlc-commit-prep"},
    {"name": "ai-sdlc-conventional-commit", "path": "skills/ai-sdlc-conventional-commit"},
    {"name": "ai-sdlc-delivery-handoff-review", "path": "skills/ai-sdlc-delivery-handoff-review"},
    {"name": "ai-sdlc-delivery-graph", "path": "skills/ai-sdlc-delivery-graph"},
    {"name": "ai-sdlc-delivery-package-gap-review", "path": "skills/ai-sdlc-delivery-package-gap-review"},
    {"name": "ai-sdlc-delivery-spec-synthesis", "path": "skills/ai-sdlc-delivery-spec-synthesis"},
    {"name": "ai-sdlc-goal-capability-and-epic-mapping", "path": "skills/ai-sdlc-goal-capability-and-epic-mapping"},
    {"name": "ai-sdlc-navigator", "path": "skills/ai-sdlc-navigator"},
    {"name": "ai-sdlc-policy", "path": "skills/ai-sdlc-policy"},
    {"name": "ai-sdlc-prfaq-package-synthesis", "path": "skills/ai-sdlc-prfaq-package-synthesis"},
    {"name": "ai-sdlc-project-context", "path": "skills/ai-sdlc-project-context"},
    {"name": "ai-sdlc-qa", "path": "skills/ai-sdlc-qa"},
    {"name": "ai-sdlc-qa-requirements-gap-review", "path": "skills/ai-sdlc-qa-requirements-gap-review"},
    {"name": "ai-sdlc-qa-traceability-and-readiness-review", "path": "skills/ai-sdlc-qa-traceability-and-readiness-review"},
    {"name": "ai-sdlc-quality-lenses", "path": "skills/ai-sdlc-quality-lenses"},
    {"name": "ai-sdlc-release-slicing-and-backlog-readiness-review", "path": "skills/ai-sdlc-release-slicing-and-backlog-readiness-review"},
    {"name": "ai-sdlc-requirements-readiness-review", "path": "skills/ai-sdlc-requirements-readiness-review"},
    {"name": "ai-sdlc-retrospective", "path": "skills/ai-sdlc-retrospective"},
    {"name": "ai-sdlc-runtime", "path": "skills/ai-sdlc-runtime"},
    {"name": "ai-sdlc-workflow", "path": "skills/ai-sdlc-workflow"},
    {"name": "ai-sdlc-sdd", "path": "skills/ai-sdlc-sdd"},
    {"name": "ai-sdlc-security-testing", "path": "skills/ai-sdlc-security-testing"},
    {"name": "ai-sdlc-test-case-and-suite-synthesis", "path": "skills/ai-sdlc-test-case-and-suite-synthesis"},
    {"name": "ai-sdlc-test-cases", "path": "skills/ai-sdlc-test-cases"},
    {"name": "ai-sdlc-test-scope-and-strategy-design", "path": "skills/ai-sdlc-test-scope-and-strategy-design"},
    {"name": "ai-sdlc-user-story-decomposition", "path": "skills/ai-sdlc-user-story-decomposition"},
    {"name": "ai-sdlc-validation", "path": "skills/ai-sdlc-validation"},
    {"name": "ai-sdlc-working-backwards-discovery", "path": "skills/ai-sdlc-working-backwards-discovery"}
  ]
}
